{
  "archived_mismatch_checkpoints": [
    {
      "case_key": "72d61d269c397f1b",
      "pair_id": "depth_boundary:stream_1",
      "path": "evidence/numerical/bosch_ray_phase_b_checkpoints/72d61d269c397f1b_cycle004.npz",
      "rays_per_point": 500,
      "sha256": "5279738e352193df19b83b44a66a9a5680ca080fee26ba7a88a9a1cb391e9db4"
    },
    {
      "case_key": "d57998a2ae5ed6cf",
      "pair_id": "depth_boundary:stream_1",
      "path": "evidence/numerical/bosch_ray_phase_b_checkpoints/d57998a2ae5ed6cf_cycle004.npz",
      "rays_per_point": 2000,
      "sha256": "a396f5420318a0b73dc01d26592e170899e39bec673898d25883414a5acd6d12"
    },
    {
      "case_key": "d79f3ec74b19a0c5",
      "pair_id": "depth_boundary:stream_2",
      "path": "evidence/numerical/bosch_ray_phase_b_checkpoints/d79f3ec74b19a0c5_cycle004.npz",
      "rays_per_point": 500,
      "sha256": "54a62083591cab8d32a4b7155ad959aee7dc2143c7eb37bdadc7da48345be578"
    },
    {
      "case_key": "1cdca72aacc77680",
      "pair_id": "depth_boundary:stream_2",
      "path": "evidence/numerical/bosch_ray_phase_b_checkpoints/1cdca72aacc77680_cycle004.npz",
      "rays_per_point": 2000,
      "sha256": "3d1c45d88d45f247ff7943effd29d26e19b879a1ae1f66bce071ba3e19797ffd"
    },
    {
      "case_key": "1d7866e8ce82bc30",
      "pair_id": "depth_boundary:stream_3",
      "path": "evidence/numerical/bosch_ray_phase_b_checkpoints/1d7866e8ce82bc30_cycle004.npz",
      "rays_per_point": 500,
      "sha256": "37c29258d93c55e99528910e2479d1dfdf366ae1e6e8bf7acb6b00d37c09ee1c"
    },
    {
      "case_key": "f3f3c4b555733bbd",
      "pair_id": "depth_boundary:stream_3",
      "path": "evidence/numerical/bosch_ray_phase_b_checkpoints/f3f3c4b555733bbd_cycle004.npz",
      "rays_per_point": 2000,
      "sha256": "ea989dc5479646cc1b0767fd3df86b488c6692af74ea3ffd88da32ad04e8a369"
    },
    {
      "case_key": "fce988e990ee9a30",
      "pair_id": "narrow_profile:stream_2",
      "path": "evidence/numerical/bosch_ray_phase_b_checkpoints/fce988e990ee9a30_cycle016.npz",
      "rays_per_point": 500,
      "sha256": "73b52c3b8d8b3919d09ff3658ef418bad01345d3c1fb59e664ff972674c5f7c3"
    },
    {
      "case_key": "0c4f535257ee3b40",
      "pair_id": "narrow_profile:stream_2",
      "path": "evidence/numerical/bosch_ray_phase_b_checkpoints/0c4f535257ee3b40_cycle016.npz",
      "rays_per_point": 2000,
      "sha256": "3d01ee9d95b923b04014e9512e113884d0d1edc2ea3459d4eb2803f0c78697d3"
    }
  ],
  "campaign": "bosch-ray-phase-b-v3",
  "categorical_mismatches": [
    {
      "mismatches": [
        "assumed_band_depth"
      ],
      "pair_id": "depth_boundary:stream_1",
      "panel_id": "depth_boundary"
    },
    {
      "mismatches": [
        "assumed_band_depth"
      ],
      "pair_id": "depth_boundary:stream_2",
      "panel_id": "depth_boundary"
    },
    {
      "mismatches": [
        "assumed_band_depth"
      ],
      "pair_id": "depth_boundary:stream_3",
      "panel_id": "depth_boundary"
    },
    {
      "mismatches": [
        "assumed_band_bow"
      ],
      "pair_id": "narrow_profile:stream_2",
      "panel_id": "narrow_profile"
    }
  ],
  "comparisons": [
    {
      "absolute_deltas": {
        "cd_bottom": 0.009659682911924317,
        "cd_max": 0.007920066421027883,
        "cd_middle": 0.0031559950074808163,
        "cd_min": 0.0016046766007890012,
        "cd_top": 0.0008221096547377793,
        "depth": 0.017549498311566047,
        "max_bow": 0.0009259251662017132,
        "max_cd_error": 0.007920066421027883,
        "maximum_center_shift": 0.0017287373336271755,
        "scallop_rms": 7.040950809823168e-05,
        "sidewall_angle_deg": 0.3259315487333327
      },
      "arm_order_in_log": [
        500,
        2000
      ],
      "case_keys": {
        "2000": "646904d3221d1cf1",
        "500": "ab1ff65b1b688bd8"
      },
      "categorical_mismatches": [],
      "continuous_equivalence_qualified": false,
      "measurements": {
        "2000": {
          "all_required_metrics_finite": true,
          "assumed_band_checks": {
            "bow": true,
            "depth": true,
            "width": true
          },
          "assumed_band_margins": {
            "bow": 0.021884467906204963,
            "depth_lower": 0.11315259908252195,
            "depth_upper": 0.08684740091747822,
            "width": 0.015035461217305313
          },
          "availability": "complete",
          "etch": {
            "cd_bottom": 0.33998294990816313,
            "cd_max": 0.3449645387826947,
            "cd_middle": 0.3276773304167818,
            "cd_min": 0.3154679172093283,
            "cd_top": 0.32936195591927286,
            "depth": 1.2631525990825219,
            "max_bow": 0.008115532093795036,
            "max_cd_error": 0.044964538782694685,
            "maximum_center_shift": 0.0009642324995672025,
            "scallop_rms": 0.0017465309726432685,
            "sidewall_angle_deg": -0.32117088439228886
          },
          "minimum_width_cells": 63.09358344186566,
          "reason_codes": [],
          "resolution_available": true,
          "selected_cycle": 30
        },
        "500": {
          "all_required_metrics_finite": true,
          "assumed_band_checks": {
            "bow": true,
            "depth": true,
            "width": true
          },
          "assumed_band_margins": {
            "bow": 0.02095854274000325,
            "depth_lower": 0.0956031007709559,
            "depth_upper": 0.10439689922904427,
            "width": 0.00711539479627743
          },
          "availability": "complete",
          "etch": {
            "cd_bottom": 0.34964263282008745,
            "cd_max": 0.35288460520372256,
            "cd_middle": 0.33083332542426264,
            "cd_min": 0.3138632406085393,
            "cd_top": 0.3285398462645351,
            "depth": 1.2456031007709558,
            "max_bow": 0.009041457259996749,
            "max_cd_error": 0.05288460520372257,
            "maximum_center_shift": 0.002692969833194378,
            "scallop_rms": 0.0018169404807415002,
            "sidewall_angle_deg": -0.6471024331256215
          },
          "minimum_width_cells": 62.77264812170786,
          "reason_codes": [],
          "resolution_available": true,
          "selected_cycle": 30
        }
      },
      "pair_id": "current_grid_reference:stream_1",
      "panel_id": "current_grid_reference",
      "repeat_index": 0,
      "runtime_ratio_2000_to_500": 3.593503177502425,
      "runtime_s": {
        "2000": 209.8575108749792,
        "500": 58.399144374998286
      },
      "seed_label": 1900000,
      "signed_deltas_500_minus_2000": {
        "cd_bottom": 0.009659682911924317,
        "cd_max": 0.007920066421027883,
        "cd_middle": 0.0031559950074808163,
        "cd_min": -0.0016046766007890012,
        "cd_top": -0.0008221096547377793,
        "depth": -0.017549498311566047,
        "max_bow": 0.0009259251662017132,
        "max_cd_error": 0.007920066421027883,
        "maximum_center_shift": 0.0017287373336271755,
        "scallop_rms": 7.040950809823168e-05,
        "sidewall_angle_deg": -0.3259315487333327
      },
      "states": {
        "2000": "complete_measured",
        "500": "complete_measured"
      }
    },
    {
      "absolute_deltas": {
        "cd_bottom": 0.011174754732670933,
        "cd_max": 3.636233503734321e-05,
        "cd_middle": 0.016436977279895237,
        "cd_min": 0.003467035693503151,
        "cd_top": 0.003209185129173009,
        "depth": 0.004000352451145384,
        "max_bow": 0.004931836642000698,
        "max_cd_error": 3.636233503745423e-05,
        "maximum_center_shift": 0.003130686175193298,
        "scallop_rms": 0.00014549562025726812,
        "sidewall_angle_deg": 0.39135019135050175
      },
      "arm_order_in_log": [
        2000,
        500
      ],
      "case_keys": {
        "2000": "d57998a2ae5ed6cf",
        "500": "72d61d269c397f1b"
      },
      "categorical_mismatches": [
        "assumed_band_depth"
      ],
      "continuous_equivalence_qualified": false,
      "measurements": {
        "2000": {
          "all_required_metrics_finite": true,
          "assumed_band_checks": {
            "bow": false,
            "depth": true,
            "width": false
          },
          "assumed_band_margins": {
            "bow": -0.05206286840051125,
            "depth_lower": 0.1965888867603236,
            "depth_upper": 0.0034111132396765775,
            "width": -0.6115766132453229
          },
          "availability": "complete",
          "etch": {
            "cd_bottom": 0.8362457395638206,
            "cd_max": 0.971576613245323,
            "cd_middle": 0.8575041223204495,
            "cd_min": 0.6005005995733974,
            "cd_top": 0.6819875442806768,
            "depth": 1.3465888867603235,
            "max_bow": 0.08206286840051125,
            "max_cd_error": 0.6715766132453229,
            "maximum_center_shift": 0.0069754818812750585,
            "scallop_rms": 0.019480304136230097,
            "sidewall_angle_deg": -4.367193148775464
          },
          "minimum_width_cells": 120.10011991467948,
          "reason_codes": [],
          "resolution_available": true,
          "selected_cycle": 4
        },
        "500": {
          "all_required_metrics_finite": true,
          "assumed_band_checks": {
            "bow": false,
            "depth": false,
            "width": false
          },
          "assumed_band_margins": {
            "bow": -0.04713103175851055,
            "depth_lower": 0.20058923921146898,
            "depth_upper": -0.0005892392114688061,
            "width": -0.6116129755803603
          },
          "availability": "complete",
          "etch": {
            "cd_bottom": 0.8474204942964916,
            "cd_max": 0.9716129755803603,
            "cd_middle": 0.8739410996003447,
            "cd_min": 0.6039676352669006,
            "cd_top": 0.6787783591515038,
            "depth": 1.350589239211469,